{
  "$schema": "http://json-schema.org/draft-07/schema#",
  "$id": "https://example.com/schemas/plan.schema.json",
  "title": "lex-pr plan schema v1",
  "description": "Schema for plan.json files - generated from Zod schema in src/schema.ts",
  "$ref": "#/definitions/Plan",
  "definitions": {
    "Plan": {
      "$schema": "http://json-schema.org/draft-07/schema#",
      "type": "object",
      "properties": {
        "schemaVersion": {
          "type": "string",
          "pattern": "^1\\.\\d+\\.\\d+$"
        },
        "target": {
          "default": "main",
          "type": "string"
        },
        "policy": {
          "type": "object",
          "properties": {
            "requiredGates": {
              "default": [],
              "type": "array",
              "items": {
                "type": "string"
              }
            },
            "optionalGates": {
              "default": [],
              "type": "array",
              "items": {
                "type": "string"
              }
            },
            "maxWorkers": {
              "default": 1,
              "type": "integer",
              "minimum": 1,
              "maximum": 9007199254740991
            },
            "retries": {
              "default": {},
              "type": "object",
              "propertyNames": {
                "type": "string"
              },
              "additionalProperties": {
                "type": "object",
                "properties": {
                  "maxAttempts": {
                    "default": 1,
                    "type": "integer",
                    "minimum": 1,
                    "maximum": 9007199254740991
                  },
                  "backoffSeconds": {
                    "default": 0,
                    "type": "number",
                    "minimum": 0
                  }
                }
              }
            },
            "overrides": {
              "default": {},
              "type": "object",
              "properties": {
                "adminGreen": {
                  "type": "object",
                  "properties": {
                    "allowedUsers": {
                      "type": "array",
                      "items": {
                        "type": "string"
                      }
                    },
                    "requireReason": {
                      "default": false,
                      "type": "boolean"
                    }
                  }
                }
              }
            },
            "blockOn": {
              "default": [],
              "type": "array",
              "items": {
                "type": "string"
              }
            },
            "mergeRule": {
              "default": {
                "type": "strict-required"
              },
              "type": "object",
              "properties": {
                "type": {
                  "default": "strict-required",
                  "type": "string",
                  "enum": [
                    "strict-required"
                  ]
                }
              }
            },
            "performance": {
              "default": {
                "batchSize": 50,
                "cacheTTLSeconds": 3600,
                "enableCaching": true,
                "throttleOnMemory": true,
                "memoryThresholdPercent": 80
              },
              "type": "object",
              "properties": {
                "maxMemoryMB": {
                  "type": "integer",
                  "minimum": 128,
                  "maximum": 9007199254740991
                },
                "batchSize": {
                  "default": 50,
                  "type": "integer",
                  "minimum": 1,
                  "maximum": 9007199254740991
                },
                "cacheTTLSeconds": {
                  "default": 3600,
                  "type": "integer",
                  "minimum": 0,
                  "maximum": 9007199254740991
                },
                "enableCaching": {
                  "default": true,
                  "type": "boolean"
                },
                "throttleOnMemory": {
                  "default": true,
                  "type": "boolean"
                },
                "memoryThresholdPercent": {
                  "default": 80,
                  "type": "number",
                  "minimum": 0,
                  "maximum": 100
                }
              }
            },
            "security": {
              "default": {
                "blockCritical": true,
                "blockHigh": true,
                "maxMedium": 5,
                "maxLow": 10
              },
              "type": "object",
              "properties": {
                "blockCritical": {
                  "default": true,
                  "type": "boolean"
                },
                "blockHigh": {
                  "default": true,
                  "type": "boolean"
                },
                "maxMedium": {
                  "default": 5,
                  "type": "integer",
                  "minimum": 0,
                  "maximum": 9007199254740991
                },
                "maxLow": {
                  "default": 10,
                  "type": "integer",
                  "minimum": 0,
                  "maximum": 9007199254740991
                }
              }
            }
          }
        },
        "items": {
          "default": [],
          "type": "array",
          "items": {
            "type": "object",
            "properties": {
              "name": {
                "type": "string"
              },
              "deps": {
                "default": [],
                "type": "array",
                "items": {
                  "type": "string"
                }
              },
              "gates": {
                "default": [],
                "type": "array",
                "items": {
                  "type": "object",
                  "properties": {
                    "name": {
                      "type": "string"
                    },
                    "run": {
                      "type": "string"
                    },
                    "cwd": {
                      "type": "string"
                    },
                    "env": {
                      "default": {},
                      "type": "object",
                      "propertyNames": {
                        "type": "string"
                      },
                      "additionalProperties": {
                        "type": "string"
                      }
                    },
                    "runtime": {
                      "default": "local",
                      "type": "string",
                      "enum": [
                        "local",
                        "container",
                        "ci-service"
                      ]
                    },
                    "container": {
                      "type": "object",
                      "properties": {
                        "image": {
                          "type": "string"
                        },
                        "entrypoint": {
                          "type": "array",
                          "items": {
                            "type": "string"
                          }
                        },
                        "mounts": {
                          "type": "array",
                          "items": {
                            "type": "object",
                            "properties": {
                              "source": {
                                "type": "string"
                              },
                              "target": {
                                "type": "string"
                              },
                              "type": {
                                "default": "bind",
                                "type": "string",
                                "enum": [
                                  "bind",
                                  "volume"
                                ]
                              }
                            },
                            "required": [
                              "source",
                              "target"
                            ]
                          }
                        }
                      },
                      "required": [
                        "image"
                      ]
                    },
                    "artifacts": {
                      "default": [],
                      "type": "array",
                      "items": {
                        "type": "string",
                        "description": "Exact literal artifact path; glob, brace, and extglob syntax is unsupported"
                      }
                    },
                    "input": {
                      "type": "object",
                      "propertyNames": {
                        "type": "string"
                      },
                      "additionalProperties": {}
                    },
                    "timeoutMs": {
                      "type": "integer",
                      "exclusiveMinimum": 0,
                      "maximum": 86400000
                    }
                  },
                  "required": [
                    "name",
                    "run"
                  ],
                  "additionalProperties": false
                }
              },
              "tier": {
                "type": "object",
                "properties": {
                  "suggested": {
                    "type": "string",
                    "enum": [
                      "senior",
                      "mid",
                      "junior"
                    ]
                  },
                  "actual": {
                    "type": "string",
                    "enum": [
                      "senior",
                      "mid",
                      "junior"
                    ]
                  },
                  "escalated": {
                    "default": false,
                    "type": "boolean"
                  },
                  "escalationReason": {
                    "type": "string"
                  },
                  "mismatch": {
                    "type": "boolean"
                  }
                },
                "required": [
                  "suggested"
                ]
              }
            },
            "required": [
              "name"
            ],
            "additionalProperties": false
          }
        },
        "gitInputs": {
          "type": "object",
          "properties": {
            "schemaVersion": {
              "type": "string",
              "const": "1.0.0"
            },
            "repository": {
              "type": "string",
              "maxLength": 2048
            },
            "checkoutRemote": {
              "type": "string",
              "maxLength": 64,
              "pattern": "^[A-Za-z0-9][A-Za-z0-9._-]*$"
            },
            "acquisition": {
              "type": "string",
              "enum": [
                "local-only",
                "fetch"
              ]
            },
            "target": {
              "type": "object",
              "properties": {
                "ref": {
                  "type": "string",
                  "maxLength": 512,
                  "pattern": "^refs\\/(?:heads\\/.+|pull\\/[1-9][0-9]*\\/head)$"
                },
                "commit": {
                  "type": "string",
                  "pattern": "^(?:[0-9a-f]{40}|[0-9a-f]{64})$"
                }
              },
              "required": [
                "ref",
                "commit"
              ],
              "additionalProperties": false
            },
            "sources": {
              "maxItems": 256,
              "type": "array",
              "items": {
                "type": "object",
                "properties": {
                  "ref": {
                    "type": "string",
                    "maxLength": 512,
                    "pattern": "^refs\\/(?:heads\\/.+|pull\\/[1-9][0-9]*\\/head)$"
                  },
                  "commit": {
                    "type": "string",
                    "pattern": "^(?:[0-9a-f]{40}|[0-9a-f]{64})$"
                  },
                  "item": {
                    "type": "string",
                    "minLength": 1,
                    "maxLength": 512
                  }
                },
                "required": [
                  "ref",
                  "commit",
                  "item"
                ],
                "additionalProperties": false
              }
            }
          },
          "required": [
            "schemaVersion",
            "repository",
            "checkoutRemote",
            "acquisition",
            "target",
            "sources"
          ],
          "additionalProperties": false
        }
      },
      "required": [
        "schemaVersion"
      ],
      "additionalProperties": false
    }
  }
}
