{
  "schemaVersion": "1.0.0",
  "target": "main",
  "policy": {
    "requiredGates": ["lint", "typecheck"],
    "optionalGates": ["test"],
    "maxWorkers": 2,
    "retries": {},
    "overrides": {},
    "blockOn": [],
    "mergeRule": {
      "type": "strict-required"
    }
  },
  "items": [
    {
      "name": "pr-123-authentication",
      "deps": [],
      "gates": [
        { "name": "lint", "run": "npm run lint" },
        { "name": "typecheck", "run": "npm run typecheck" }
      ]
    },
    {
      "name": "pr-124-api",
      "deps": ["pr-123-authentication"],
      "gates": [
        { "name": "lint", "run": "npm run lint" },
        { "name": "typecheck", "run": "npm run typecheck" },
        { "name": "test", "run": "npm test" }
      ]
    },
    {
      "name": "pr-125-ui",
      "deps": [],
      "gates": [
        { "name": "lint", "run": "npm run lint" },
        { "name": "typecheck", "run": "npm run typecheck" }
      ]
    },
    {
      "name": "pr-126-integration",
      "deps": ["pr-124-api", "pr-125-ui"],
      "gates": [
        { "name": "lint", "run": "npm run lint" },
        { "name": "typecheck", "run": "npm run typecheck" },
        { "name": "test", "run": "npm test" }
      ]
    }
  ]
}
